{
  "id": "AHE-0021",
  "title": "Production Archive Record Title",
  "medium": "Illustration",
  "year": 2026,
  "publishedAt": "2026-06-14",
  "score": 80,
  "intensity": "Medium",
  "status": "Draft",
  "tags": [
    "archive-first",
    "classification"
  ],
  "note": "作品の分類理由、参照ポイント、表現上の特徴を簡潔に記録します。",
  "circle": "Production Circle Name",
  "characters": [
    "Production Character Name"
  ],
  "performers": [
    "Production Performer Name"
  ],
  "maker": "Production Maker Name",
  "label": "Production Label Name",
  "release": "2026-06-14",
  "runtime": "00:00",
  "archiveNote": "研究アーカイブとしての登録理由を記録します。",
  "reviewerNote": "確認者による補足や評価根拠を記録します。",
  "verification": "Draft",
  "metadata": {
    "productId": "product-id",
    "maker": "Production Maker Name",
    "label": "Production Label Name",
    "runtime": "00:00",
    "verification": "Draft"
  },
  "scoreDetails": {
    "expression": 80,
    "composition": 80,
    "context": 80,
    "archive-value": 80
  },
  "tagCategories": {
    "expression": [
      "archive-first"
    ],
    "format": [
      "classification"
    ]
  },
  "thumbnail": {
    "label": "#0021",
    "accent": "#7C5CFF",
    "background": "#111115"
  }
}
